{
  "schemaVersion": "1.0.0",
  "product": "project-skills-orchestrator",
  "version": "1.1.2",
  "evaluatedAt": "2026-09-12T16:40:40.540Z",
  "commit": "14441804ecd6d2fcd700c4ecc96cc33a4947a08f",
  "candidateSha256": "fad9a3ecd5c84eafdcfcbff18fc61e8953ce7f0c4a4abd265d25a097fc9fb969",
  "status": "blocked",
  "checks": [
    {
      "id": "source-revision",
      "status": "passed",
      "blocking": true,
      "evidence": "14441804ecd6d2fcd700c4ecc96cc33a4947a08f"
    },
    {
      "id": "clean-worktree",
      "status": "passed",
      "blocking": true,
      "evidence": "Release source clean; report-only changes excluded"
    },
    {
      "id": "security-scan",
      "status": "passed",
      "blocking": true,
      "evidence": "221 files; digest f5596bcee9984eddbe84b0551b71bac6b5a888b90f3e6a99b5d027ec0bdfbbcd"
    },
    {
      "id": "release-candidate-integrity",
      "status": "passed",
      "blocking": true,
      "evidence": "Verified unsigned release candidate: 161 checksum-covered files"
    },
    {
      "id": "cross-platform-ci",
      "status": "blocked",
      "blocking": true,
      "evidence": "Current-commit Windows, Linux, and macOS evidence for Node 22, 24, and 26 is missing"
    },
    {
      "id": "operational-readiness",
      "status": "blocked",
      "blocking": true,
      "evidence": "Candidate-bound owner assignments, fresh monitoring signals, or tested revocation evidence are incomplete"
    },
    {
      "id": "trusted-signature",
      "status": "blocked",
      "blocking": true,
      "evidence": "Trusted release signature or external signing key fingerprint is not provisioned"
    },
    {
      "id": "independent-review",
      "status": "blocked",
      "blocking": true,
      "evidence": "Trusted independent reviewer evidence is not provisioned"
    },
    {
      "id": "production-verification",
      "status": "blocked",
      "blocking": true,
      "evidence": "file:///C:/repos/Skills-Orchestrator/scripts/verify-release.mjs:77\r\nif (!existsSync(signaturePath)) throw new Error(\"Production release blocked: release-signature.json is missing\");\r\n                                      ^\r\n\r\nError: Production release blocked: release-signature.json is missing\r\n    at file:///C:/repos/Skills-Orchestrator/scripts/verify-release.mjs:77:39\r\n\r\nNode.js v24.14.1"
    }
  ]
}
